{
  "schemaVersion": 1,
  "generatorVersion": "0.1.0-minimum",
  "exportId": "minimum-00019919-160x160",
  "seed": 104729,
  "parameters": {
    "width": 160,
    "height": 160,
    "corridorWidth": 4,
    "doorOpenRate": 0.5
  },
  "grid": {
    "width": 160,
    "height": 160,
    "cellSize": 1
  },
  "coordinateSystem": {
    "up": "Y",
    "forward": "-Z",
    "handedness": "right"
  },
  "assetPack": {
    "id": "placeholder-kit",
    "version": "1"
  },
  "rooms": [
    {
      "id": "room-entrance",
      "x": 40,
      "z": 66,
      "width": 28,
      "depth": 28,
      "kind": "entrance"
    },
    {
      "id": "room-exit",
      "x": 92,
      "z": 66,
      "width": 28,
      "depth": 28,
      "kind": "exit"
    }
  ],
  "connections": [
    {
      "id": "connection-main",
      "fromRoomId": "room-entrance",
      "toRoomId": "room-exit",
      "corridorId": "corridor-main",
      "doorIds": [
        "door-entrance",
        "door-exit"
      ]
    }
  ],
  "corridors": [
    {
      "id": "corridor-main",
      "x": 68,
      "z": 78,
      "width": 24,
      "depth": 4
    }
  ],
  "doors": [
    {
      "id": "door-entrance",
      "position": [
        -12,
        1.25,
        0
      ],
      "rotationY": 0,
      "open": true
    },
    {
      "id": "door-exit",
      "position": [
        12,
        1.25,
        0
      ],
      "rotationY": 0,
      "open": false
    }
  ],
  "spawn": {
    "position": [
      -30.200000000000003,
      0.1,
      0
    ],
    "rotationY": -1.5707963267948966
  },
  "modules": [
    {
      "id": "module-room-entrance-floor",
      "kind": "floor",
      "center": [
        -26,
        -0.1,
        0
      ],
      "size": [
        28,
        0.2,
        28
      ],
      "rotationY": 0
    },
    {
      "id": "module-room-exit-floor",
      "kind": "floor",
      "center": [
        26,
        -0.1,
        0
      ],
      "size": [
        28,
        0.2,
        28
      ],
      "rotationY": 0
    },
    {
      "id": "module-room-entrance-north-wall",
      "kind": "wall",
      "center": [
        -26,
        1.25,
        -14
      ],
      "size": [
        28,
        2.5,
        0.3
      ],
      "rotationY": 0
    },
    {
      "id": "module-room-entrance-south-wall",
      "kind": "wall",
      "center": [
        -26,
        1.25,
        14
      ],
      "size": [
        28,
        2.5,
        0.3
      ],
      "rotationY": 0
    },
    {
      "id": "module-room-entrance-solid-wall",
      "kind": "wall",
      "center": [
        -40,
        1.25,
        0
      ],
      "size": [
        0.3,
        2.5,
        28
      ],
      "rotationY": 0
    },
    {
      "id": "module-room-entrance-door-wall-a",
      "kind": "wall",
      "center": [
        -12,
        1.25,
        -8
      ],
      "size": [
        0.3,
        2.5,
        12
      ],
      "rotationY": 0
    },
    {
      "id": "module-room-entrance-door-wall-b",
      "kind": "wall",
      "center": [
        -12,
        1.25,
        8
      ],
      "size": [
        0.3,
        2.5,
        12
      ],
      "rotationY": 0
    },
    {
      "id": "module-room-exit-north-wall",
      "kind": "wall",
      "center": [
        26,
        1.25,
        -14
      ],
      "size": [
        28,
        2.5,
        0.3
      ],
      "rotationY": 0
    },
    {
      "id": "module-room-exit-south-wall",
      "kind": "wall",
      "center": [
        26,
        1.25,
        14
      ],
      "size": [
        28,
        2.5,
        0.3
      ],
      "rotationY": 0
    },
    {
      "id": "module-room-exit-solid-wall",
      "kind": "wall",
      "center": [
        40,
        1.25,
        0
      ],
      "size": [
        0.3,
        2.5,
        28
      ],
      "rotationY": 0
    },
    {
      "id": "module-room-exit-door-wall-a",
      "kind": "wall",
      "center": [
        12,
        1.25,
        -8
      ],
      "size": [
        0.3,
        2.5,
        12
      ],
      "rotationY": 0
    },
    {
      "id": "module-room-exit-door-wall-b",
      "kind": "wall",
      "center": [
        12,
        1.25,
        8
      ],
      "size": [
        0.3,
        2.5,
        12
      ],
      "rotationY": 0
    },
    {
      "id": "module-corridor-floor",
      "kind": "floor",
      "center": [
        0,
        -0.1,
        0
      ],
      "size": [
        24,
        0.2,
        4
      ],
      "rotationY": 0
    },
    {
      "id": "module-corridor-north-wall",
      "kind": "wall",
      "center": [
        0,
        1.25,
        -2
      ],
      "size": [
        24,
        2.5,
        0.3
      ],
      "rotationY": 0
    },
    {
      "id": "module-corridor-south-wall",
      "kind": "wall",
      "center": [
        0,
        1.25,
        2
      ],
      "size": [
        24,
        2.5,
        0.3
      ],
      "rotationY": 0
    },
    {
      "id": "module-door-entrance",
      "kind": "door-open",
      "center": [
        -12,
        1.25,
        0
      ],
      "size": [
        0.3,
        2.5,
        4
      ],
      "rotationY": 1.5707963267948966
    },
    {
      "id": "module-door-exit",
      "kind": "door-closed",
      "center": [
        12,
        1.25,
        0
      ],
      "size": [
        0.3,
        2.5,
        4
      ],
      "rotationY": 0
    }
  ],
  "colliders": [
    {
      "id": "collider-room-entrance-floor",
      "kind": "floor",
      "center": [
        -26,
        -0.1,
        0
      ],
      "size": [
        28,
        0.2,
        28
      ]
    },
    {
      "id": "collider-room-exit-floor",
      "kind": "floor",
      "center": [
        26,
        -0.1,
        0
      ],
      "size": [
        28,
        0.2,
        28
      ]
    },
    {
      "id": "collider-room-entrance-north-wall",
      "kind": "wall",
      "center": [
        -26,
        1.25,
        -14
      ],
      "size": [
        28,
        2.5,
        0.3
      ]
    },
    {
      "id": "collider-room-entrance-south-wall",
      "kind": "wall",
      "center": [
        -26,
        1.25,
        14
      ],
      "size": [
        28,
        2.5,
        0.3
      ]
    },
    {
      "id": "collider-room-entrance-solid-wall",
      "kind": "wall",
      "center": [
        -40,
        1.25,
        0
      ],
      "size": [
        0.3,
        2.5,
        28
      ]
    },
    {
      "id": "collider-room-entrance-door-wall-a",
      "kind": "wall",
      "center": [
        -12,
        1.25,
        -8
      ],
      "size": [
        0.3,
        2.5,
        12
      ]
    },
    {
      "id": "collider-room-entrance-door-wall-b",
      "kind": "wall",
      "center": [
        -12,
        1.25,
        8
      ],
      "size": [
        0.3,
        2.5,
        12
      ]
    },
    {
      "id": "collider-room-exit-north-wall",
      "kind": "wall",
      "center": [
        26,
        1.25,
        -14
      ],
      "size": [
        28,
        2.5,
        0.3
      ]
    },
    {
      "id": "collider-room-exit-south-wall",
      "kind": "wall",
      "center": [
        26,
        1.25,
        14
      ],
      "size": [
        28,
        2.5,
        0.3
      ]
    },
    {
      "id": "collider-room-exit-solid-wall",
      "kind": "wall",
      "center": [
        40,
        1.25,
        0
      ],
      "size": [
        0.3,
        2.5,
        28
      ]
    },
    {
      "id": "collider-room-exit-door-wall-a",
      "kind": "wall",
      "center": [
        12,
        1.25,
        -8
      ],
      "size": [
        0.3,
        2.5,
        12
      ]
    },
    {
      "id": "collider-room-exit-door-wall-b",
      "kind": "wall",
      "center": [
        12,
        1.25,
        8
      ],
      "size": [
        0.3,
        2.5,
        12
      ]
    },
    {
      "id": "collider-corridor-floor",
      "kind": "floor",
      "center": [
        0,
        -0.1,
        0
      ],
      "size": [
        24,
        0.2,
        4
      ]
    },
    {
      "id": "collider-corridor-north-wall",
      "kind": "wall",
      "center": [
        0,
        1.25,
        -2
      ],
      "size": [
        24,
        2.5,
        0.3
      ]
    },
    {
      "id": "collider-corridor-south-wall",
      "kind": "wall",
      "center": [
        0,
        1.25,
        2
      ],
      "size": [
        24,
        2.5,
        0.3
      ]
    },
    {
      "id": "collider-door-exit",
      "kind": "door",
      "center": [
        12,
        1.25,
        0
      ],
      "size": [
        0.3,
        2.5,
        4
      ]
    }
  ],
  "diagnostics": {
    "warnings": [
      "Minimum slice uses procedural placeholder modules."
    ]
  },
  "glbSha256": "01c0abb35d096cb5ef1e2201b5709071cd9a68abb9e3025e3b03ce6686c455cd"
}
